{
  "type": "api-key",
  "provider": "gitlab",
  "applicationId": "status-foundry.gitlab",
  "placement": {
    "in": "header",
    "name": "PRIVATE-TOKEN"
  },
  "fields": [
    {
      "key": "token",
      "label": "Personal access token",
      "type": "secret",
      "placeholder": "glpat-...",
      "help": "Use a read-only token with access to the project.",
      "required": true
    }
  ]
}
