{
  "type": "basic-auth",
  "provider": "jira",
  "applicationId": "status-foundry.jira",
  "fields": [
    {
      "key": "email",
      "label": "Atlassian email",
      "type": "text",
      "placeholder": "you@example.com",
      "help": "Use the Atlassian account email that owns the API token.",
      "required": true
    },
    {
      "key": "apiToken",
      "label": "API token",
      "type": "secret",
      "placeholder": "ATATT...",
      "help": "Create an Atlassian API token with access to the selected Jira project.",
      "required": true
    }
  ]
}
