{
  "type": "jwt-api-key",
  "provider": "appstoreconnect",
  "applicationId": "status-foundry.appstoreconnect",
  "fields": [
    {
      "key": "issuerId",
      "label": "Issuer ID",
      "type": "text",
      "required": true,
      "placeholder": "App Store Connect issuer ID"
    },
    {
      "key": "keyId",
      "label": "Key ID",
      "type": "text",
      "required": true,
      "placeholder": "API key ID"
    },
    {
      "key": "privateKey",
      "label": "Private Key",
      "type": "secret-file",
      "required": true,
      "placeholder": "Paste the .p8 private key"
    }
  ]
}
